Addendum BB -- ASC Covered Ancillary Services Integral to Covered Surgical Procedures for CY 2025 (Including Ancillary Services for Which Payment is Packaged),,,,,,,
CPT codes and descriptions only are copyright 2024 American Medical Association.ÿ All Rights Reserved.ÿ Applicable FARS/DFARS Apply.  Dental codes (D codes) are copyright 2024 American Dental Association.ÿ All Rights Reserved.,,,,,,,
,,,,,,,
HCPCS Code,,Short Descriptor,Drug and Device Pass-Through Expiration during Calendar Year,January 2025 Payment Indicator,January 2025 Payment Weight  ,January 2025 Payment Rate ,January 2025 IRA-22 Adjusted Copayment1
0331T,,Heart symp image plnr,,Z2,12.983,$712.70,
0332T,,Heart symp image plnr spect,,Z2,12.983,$712.70,
0394T,,Hdr elctrnc skn surf brchytx,,Z2,2.5722,$141.20,
0395T,,Hdr elctr ntrst/ntrcv brchtx,,Z2,6.8543,$376.27,
0422T,,Tactile breast img uni/bi,,Z2,0.8852,$48.59,
0598T,,Ncntc r-t fluor wnd img 1st,,Z2,3.0278,$166.21,
0599T,,Ncntc r-t fluor wnd img ea,,N1,,,
0609T,,Mrs disc pain acquisj data,,Z2,2.3732,$130.28,
0611T,,Mrs disc pain alg alys data,,Z2,2.3732,$130.28,
0633T,,Ct breast w/3d uni c-,,Z2,1.033,$56.71,
0634T,,Ct breast w/3d uni c+,,Z2,1.7618,$96.71,
0635T,,Ct breast w/3d uni c-/c+,,Z2,1.7618,$96.71,
0636T,,Ct breast w/3d bi c-,,Z2,2.3732,$130.28,
0637T,,Ct breast w/3d bi c+,,Z2,3.511,$192.74,
0638T,,Ct breast w/3d bi c-/c+,,Z2,3.511,$192.74,
0648T,,Quan mr tis wo mri 1orgn,,Z2,9.2951,$510.25,
0689T,,Quan us tis charac w/o dx us,,Z2,0.8852,$48.59,
0697T,,Quan mr tis wo mri mlt orgn,,Z2,9.2951,$510.25,
0698T,,Quan mr tiss w/mri mlt orgn,,Z2,9.2951,$510.25,
0870T,,Imp subq prtl ascts pmp sys,,K5,,,
0871T,,Rplcmt subq prtl ascites pmp,,K5,,,
0872T,,Rplcmt ndwllg bldr&prtl cath,,K5,,,
0873T,,Revj subq prtl asct pmp sys,,K5,,,
0874T,,Rmvl pertl ascites pmp sys,,K5,,,
0875T,,Prgrm subq prtl asct pmp sys,,K5,,,
0882T,,Intraop ther estim pn ue 1st,,N1,,,
0883T,,Intraop ther estim pn ue ea,,N1,,,
0887T,,End-tidal ctrl inhaled anes,,N1,,,
0946T,,Ortho impl mvmt alys pair ct,,Z2,1.033,$56.71,
70010,,Contrast x-ray of brain,,N1,,,
70015,,Contrast x-ray of brain,,N1,,,
70030,,X-ray eye for foreign body,,N1,,,
70100,,X-ray exam of jaw <4views,,N1,,,
70110,,X-ray exam of jaw 4/> views,,N1,,,
70120,,X-ray exam of mastoids,,N1,,,
70130,,X-ray exam of mastoids,,N1,,,
70134,,X-ray exam of middle ear,,N1,,,
70140,,X-ray exam of facial bones,,N1,,,
70150,,X-ray exam of facial bones,,N1,,,
70160,,X-ray exam of nasal bones,,N1,,,
70170,,X-ray exam of tear duct,,N1,,,
70190,,X-ray exam of eye sockets,,N1,,,
70200,,X-ray exam of eye sockets,,N1,,,
70210,,X-ray exam of sinuses,,N1,,,
70220,,X-ray exam of sinuses,,N1,,,
70240,,X-ray exam pituitary saddle,,N1,,,
70250,,X-ray exam of skull,,N1,,,
70260,,X-ray exam of skull,,N1,,,
70300,,X-ray exam of teeth,,N1,,,
70310,,X-ray exam of teeth,,N1,,,
70320,,Full mouth x-ray of teeth,,N1,,,
70328,,X-ray exam of jaw joint,,N1,,,
70330,,X-ray exam of jaw joints,,N1,,,
70332,,X-ray exam of jaw joint,,N1,,,
70336,,Magnetic image jaw joint,,Z2,2.3732,$130.28,
70350,,X-ray head for orthodontia,,N1,,,
70355,,Panoramic x-ray of jaws,,N1,,,
70360,,X-ray exam of neck,,N1,,,
70370,,Throat x-ray & fluoroscopy,,N1,,,
70371,,Speech evaluation complex,,N1,,,
70380,,X-ray exam of salivary gland,,N1,,,
70390,,X-ray exam of salivary duct,,N1,,,
70450,,Ct head/brain w/o dye,,Z2,1.033,$56.71,
70460,,Ct head/brain w/dye,,Z3,,$94.13,
70470,,Ct head/brain w/o & w/dye,,Z2,1.7618,$96.71,
70480,,Ct orbit/ear/fossa w/o dye,,Z2,1.033,$56.71,
70481,,Ct orbit/ear/fossa w/dye,,Z2,1.7618,$96.71,
70482,,Ct orbit/ear/fossa w/o&w/dye,,Z2,1.7618,$96.71,
70486,,Ct maxillofacial w/o dye,,Z2,1.033,$56.71,
70487,,Ct maxillofacial w/dye,,Z2,1.7618,$96.71,
70488,,Ct maxillofacial w/o & w/dye,,Z2,1.7618,$96.71,
70490,,Ct soft tissue neck w/o dye,,Z2,1.033,$56.71,
70491,,Ct soft tissue neck w/dye,,Z2,1.7618,$96.71,
70492,,Ct sft tsue nck w/o & w/dye,,Z2,1.7618,$96.71,
70496,,Ct angiography head,,Z2,1.7618,$96.71,
70498,,Ct angiography neck,,Z2,1.7618,$96.71,
70540,,Mri orbit/face/neck w/o dye,,Z2,2.3732,$130.28,
70542,,Mri orbit/face/neck w/dye,,Z3,,$188.26,
70543,,Mri orbt/fac/nck w/o &w/dye,,Z2,3.511,$192.74,
70544,,Mr angiography head w/o dye,,Z2,2.3732,$130.28,
70545,,Mr angiography head w/dye,,Z3,,$168.85,
70546,,Mr angiograph head w/o&w/dye,,Z2,3.511,$192.74,
70547,,Mr angiography neck w/o dye,,Z2,2.3732,$130.28,
70548,,Mr angiography neck w/dye,,Z3,,$173.38,
70549,,Mr angiograph neck w/o&w/dye,,Z2,3.511,$192.74,
70551,,Mri brain stem w/o dye,,Z3,,$125.50,
70552,,Mri brain stem w/dye,,Z3,,$184.38,
70553,,Mri brain stem w/o & w/dye,,Z2,3.511,$192.74,
70554,,Fmri brain by tech,,Z2,2.3732,$130.28,
70555,,Fmri brain by phys/psych,,Z2,2.3732,$130.28,
70557,,Mri brain w/o dye,,Z2,5.3155,$291.79,
70558,,Mri brain w/dye,,Z2,1.7618,$96.71,
70559,,Mri brain w/o & w/dye,,Z2,1.7618,$96.71,
71045,,X-ray exam chest 1 view,,Z3,,$16.50,
71046,,X-ray exam chest 2 views,,Z3,,$22.32,
71047,,X-ray exam chest 3 views,,N1,,,
71048,,X-ray exam chest 4+ views,,N1,,,
71100,,X-ray exam ribs uni 2 views,,N1,,,
71101,,X-ray exam unilat ribs/chest,,N1,,,
71110,,X-ray exam ribs bil 3 views,,N1,,,
71111,,X-ray exam ribs/chest4/> vws,,N1,,,
71120,,X-ray exam breastbone 2/>vws,,N1,,,
71130,,X-ray strenoclavic jt 3/>vws,,N1,,,
71250,,Ct thorax dx c-,,Z2,1.033,$56.71,
71260,,Ct thorax dx c+,,Z2,1.7618,$96.71,
71270,,Ct thorax dx c-/c+,,Z2,1.7618,$96.71,
71275,,Ct angiography chest,,Z2,1.7618,$96.71,
71550,,Mri chest w/o dye,,Z2,2.3732,$130.28,
71551,,Mri chest w/dye,,Z3,,$287.56,
71552,,Mri chest w/o & w/dye,,Z2,3.511,$192.74,
72020,,X-ray exam of spine 1 view,,N1,,,
72040,,X-ray exam neck spine 2-3 vw,,N1,,,
72050,,X-ray exam neck spine 4/5vws,,N1,,,
72052,,X-ray exam neck spine 6/>vws,,N1,,,
72070,,X-ray exam thorac spine 2vws,,N1,,,
72072,,X-ray exam thorac spine 3vws,,N1,,,
72074,,X-ray exam thorac spine4/>vw,,N1,,,
72080,,X-ray exam thoracolmb 2/> vw,,N1,,,
72081,,X-ray exam entire spi 1 vw,,N1,,,
72082,,X-ray exam entire spi 2/3 vw,,N1,,,
72083,,X-ray exam entire spi 4/5 vw,,Z2,1.033,$56.71,
72084,,X-ray exam entire spi 6/> vw,,Z2,1.033,$56.71,
72100,,X-ray exam l-s spine 2/3 vws,,N1,,,
72110,,X-ray exam l-2 spine 4/>vws,,N1,,,
72114,,X-ray exam l-s spine bending,,N1,,,
72120,,X-ray bend only l-s spine,,N1,,,
72125,,Ct neck spine w/o dye,,Z2,1.033,$56.71,
72126,,Ct neck spine w/dye,,Z3,,$109.98,
72127,,Ct neck spine w/o & w/dye,,Z2,1.7618,$96.71,
72128,,Ct chest spine w/o dye,,Z2,1.033,$56.71,
72129,,Ct chest spine w/dye,,Z2,1.7618,$96.71,
72130,,Ct chest spine w/o & w/dye,,Z2,1.7618,$96.71,
72131,,Ct lumbar spine w/o dye,,Z2,1.033,$56.71,
72132,,Ct lumbar spine w/dye,,Z3,,$110.63,
72133,,Ct lumbar spine w/o & w/dye,,Z2,1.7618,$96.71,
72141,,Mri neck spine w/o dye,,Z3,,$119.36,
72142,,Mri neck spine w/dye,,Z3,,$187.93,
72146,,Mri chest spine w/o dye,,Z3,,$119.68,
72147,,Mri chest spine w/dye,,Z3,,$185.99,
72148,,Mri lumbar spine w/o dye,,Z3,,$120.01,
72149,,Mri lumbar spine w/dye,,Z3,,$183.40,
72156,,Mri neck spine w/o & w/dye,,Z2,3.511,$192.74,
72157,,Mri chest spine w/o & w/dye,,Z2,3.511,$192.74,
72158,,Mri lumbar spine w/o & w/dye,,Z2,3.511,$192.74,
72170,,X-ray exam of pelvis,,N1,,,
72190,,X-ray exam of pelvis,,N1,,,
72191,,Ct angiograph pelv w/o&w/dye,,Z2,1.7618,$96.71,
72192,,Ct pelvis w/o dye,,Z2,1.033,$56.71,
72193,,Ct pelvis w/dye,,Z2,1.7618,$96.71,
72194,,Ct pelvis w/o & w/dye,,Z2,1.7618,$96.71,
72195,,Mri pelvis w/o dye,,Z2,2.3732,$130.28,
72196,,Mri pelvis w/dye,,Z3,,$184.70,
72197,,Mri pelvis w/o & w/dye,,Z2,3.511,$192.74,
72200,,X-ray exam si joints,,N1,,,
72202,,X-ray exam si joints 3/> vws,,N1,,,
72220,,X-ray exam sacrum tailbone,,N1,,,
72240,,Myelography neck spine,,N1,,,
72255,,Myelography thoracic spine,,N1,,,
72265,,Myelography l-s spine,,N1,,,
72270,,Myelogphy 2/> spine regions,,N1,,,
72285,,Discography cerv/thor spine,,N1,,,
72295,,X-ray of lower spine disk,,N1,,,
73000,,X-ray exam of collar bone,,N1,,,
73010,,X-ray exam of shoulder blade,,N1,,,
73020,,X-ray exam of shoulder,,N1,,,
73030,,X-ray exam of shoulder,,N1,,,
73040,,Contrast x-ray of shoulder,,N1,,,
73050,,X-ray exam of shoulders,,N1,,,
73060,,X-ray exam of humerus,,N1,,,
73070,,X-ray exam of elbow,,N1,,,
73080,,X-ray exam of elbow,,N1,,,
73085,,Contrast x-ray of elbow,,N1,,,
73090,,X-ray exam of forearm,,N1,,,
73092,,X-ray exam of arm infant,,N1,,,
73100,,X-ray exam of wrist,,N1,,,
73110,,X-ray exam of wrist,,N1,,,
73115,,Contrast x-ray of wrist,,N1,,,
73120,,X-ray exam of hand,,N1,,,
73130,,X-ray exam of hand,,N1,,,
73140,,X-ray exam of finger(s),,N1,,,
73200,,Ct upper extremity w/o dye,,Z2,1.033,$56.71,
73201,,Ct upper extremity w/dye,,Z3,,$143.29,
73202,,Ct uppr extremity w/o&w/dye,,Z2,1.7618,$96.71,
73206,,Ct angio upr extrm w/o&w/dye,,Z2,1.7618,$96.71,
73218,,Mri upper extremity w/o dye,,Z2,2.3732,$130.28,
73219,,Mri upper extremity w/dye,,Z2,3.511,$192.74,
73220,,Mri uppr extremity w/o&w/dye,,Z2,3.511,$192.74,
73221,,Mri joint upr extrem w/o dye,,Z2,2.3732,$130.28,
73222,,Mri joint upr extrem w/dye,,Z3,,$230.63,
73223,,Mri joint upr extr w/o&w/dye,,Z2,3.511,$192.74,
73501,,X-ray exam hip uni 1 view,,N1,,,
73502,,X-ray exam hip uni 2-3 views,,N1,,,
73503,,X-ray exam hip uni 4/> views,,N1,,,
73521,,X-ray exam hips bi 2 views,,N1,,,
73522,,X-ray exam hips bi 3-4 views,,N1,,,
73523,,X-ray exam hips bi 5/> views,,N1,,,
73525,,Contrast x-ray of hip,,N1,,,
73551,,X-ray exam of femur 1,,N1,,,
73552,,X-ray exam of femur 2/>,,N1,,,
73560,,X-ray exam of knee 1 or 2,,N1,,,
73562,,X-ray exam of knee 3,,N1,,,
73564,,X-ray exam knee 4 or more,,N1,,,
73565,,X-ray exam of knees,,N1,,,
73580,,Contrast x-ray of knee joint,,N1,,,
73590,,X-ray exam of lower leg,,N1,,,
73592,,X-ray exam of leg infant,,N1,,,
73600,,X-ray exam of ankle,,N1,,,
73610,,X-ray exam of ankle,,N1,,,
73615,,Contrast x-ray of ankle,,N1,,,
73620,,X-ray exam of foot,,N1,,,
73630,,X-ray exam of foot,,N1,,,
73650,,X-ray exam of heel,,N1,,,
73660,,X-ray exam of toe(s),,N1,,,
73700,,Ct lower extremity w/o dye,,Z2,1.033,$56.71,
73701,,Ct lower extremity w/dye,,Z2,1.7618,$96.71,
73702,,Ct lwr extremity w/o&w/dye,,Z2,1.7618,$96.71,
73706,,Ct angio lwr extr w/o&w/dye,,Z2,1.7618,$96.71,
73718,,Mri lower extremity w/o dye,,Z2,2.3732,$130.28,
73719,,Mri lower extremity w/dye,,Z3,,$183.73,
73720,,Mri lwr extremity w/o&w/dye,,Z2,3.511,$192.74,
73721,,Mri jnt of lwr extre w/o dye,,Z2,2.3732,$130.28,
73722,,Mri joint of lwr extr w/dye,,Z3,,$232.25,
73723,,Mri joint lwr extr w/o&w/dye,,Z2,3.511,$192.74,
74018,,Radex abdomen 1 view,,N1,,,
74019,,Radex abdomen 2 views,,N1,,,
74021,,Radex abdomen 3+ views,,N1,,,
74022,,Radex compl aqt abd series,,N1,,,
74150,,Ct abdomen w/o contrast,,Z2,1.033,$56.71,
74160,,Ct abdomen w/contrast,,Z2,1.7618,$96.71,
74170,,Ct abd wo cntrst flwd cntrst,,Z2,1.7618,$96.71,
74174,,Cta abd&plvs w/contrast,,Z2,3.511,$192.74,
74175,,Cta abdomen w/contrast,,Z2,1.7618,$96.71,
74176,,Ct abd & pelvis w/o contrast,,Z3,,$100.92,
74177,,Ct abd & pelvis w/contrast,,Z2,3.511,$192.74,
74178,,Ct abd&plv wo cntr flwd cntr,,Z2,3.511,$192.74,
74181,,Mri abdomen w/o contrast,,Z3,,$125.50,
74182,,Mri abdomen w/contrast,,Z2,3.511,$192.74,
74183,,Mri abd w/o cntr flwd cntr,,Z2,3.511,$192.74,
74190,,Peritoneogram rs&i,,N1,,,
74210,,X-ray xm phrnx&/crv esoph c+,,N1,,,
74220,,X-ray xm esophagus 1cntrst,,N1,,,
74221,,X-ray xm esophagus 2cntrst,,N1,,,
74230,,X-ray xm swlng funcj c+,,Z3,,$93.48,
74235,,Remove esophagus obstruction,,N1,,,
74240,,X-ray xm upr gi trc 1cntrst,,Z3,,$79.90,
74246,,X-ray xm upr gi trc 2cntrst,,Z3,,$91.22,
74248,,X-ray sm int f-thru std,,N1,,,
74250,,X-ray xm sm int 1cntrst std,,Z3,,$79.25,
74251,,X-ray xm sm int 2cntrst std,,Z2,1.7618,$96.71,
74261,,Ct colonography dx,,Z2,1.033,$56.71,
74262,,Ct colonography dx w/dye,,Z2,1.7618,$96.71,
74270,,X-ray xm colon 1cntrst std,,N1,,,
74280,,X-ray xm colon 2cntrst std,,N1,,,
74283,,Ther nma rdctj intus/obstrcj,,Z2,1.7618,$96.71,
74290,,Contrast x-ray gallbladder,,N1,,,
74300,,X-ray bile ducts/pancreas,,N1,,,
74301,,X-rays at surgery add-on,,N1,,,
74328,,X-ray bile duct endoscopy,,N1,,,
74329,,X-ray for pancreas endoscopy,,N1,,,
74330,,X-ray bile/panc endoscopy,,N1,,,
74340,,X-ray guide for gi tube,,N1,,,
74355,,X-ray guide intestinal tube,,N1,,,
74360,,X-ray guide gi dilation,,N1,,,
74363,,X-ray bile duct dilation,,N1,,,
74400,,Urography iv +-kub tomog,,Z2,1.7618,$96.71,
74410,,Urography nfs drip&/bolus,,Z2,1.7618,$96.71,
74415,,Urography nfs drip&/bls w/nf,,Z2,1.7618,$96.71,
74420,,Urography rtrgr +-kub,,Z2,3.511,$192.74,
74425,,Urography antegrade rs&i,,N1,,,
74430,,Contrast x-ray bladder,,N1,,,
74440,,X-ray male genital tract,,N1,,,
74445,,X-ray exam of penis,,N1,,,
74450,,X-ray urethra/bladder,,N1,,,
74455,,X-ray urethra/bladder,,N1,,,
74470,,X-ray exam of kidney lesion,,N1,,,
74485,,Dilation urtr/urt rs&i,,N1,,,
74712,,Mri fetal sngl/1st gestation,,Z2,2.3732,$130.28,
74713,,Mri fetal ea addl gestation,,N1,,,
74740,,X-ray female genital tract,,N1,,,
74742,,X-ray fallopian tube,,N1,,,
74775,,X-ray exam of perineum,,Z2,2.3732,$130.28,
75557,,Cardiac mri for morph,,Z2,2.3732,$130.28,
75559,,Cardiac mri w/stress img,,Z3,,$231.92,
75561,,Cardiac mri for morph w/dye,,Z2,3.511,$192.74,
75563,,Card mri w/stress img & dye,,Z3,,$277.53,
75565,,Card mri veloc flow mapping,,N1,,,
75571,,Ct hrt w/o dye w/ca test,,N1,,,
75572,,Ct hrt w/3d image,,Z3,,$144.59,
75573,,Ct hrt c+ strux cgen hrt ds,,Z3,,$184.38,
75574,,Ct angio hrt w/3d image,,Z2,3.511,$192.74,
75600,,Contrast exam thoracic aorta,,N1,,,
75605,,Contrast exam thoracic aorta,,N1,,,
75625,,Contrast exam abdominl aorta,,N1,,,
75630,,X-ray aorta leg arteries,,N1,,,
75635,,Ct angio abdominal arteries,,N1,,,
75705,,Artery x-rays spine,,N1,,,
75710,,Artery x-rays arm/leg,,N1,,,
75716,,Artery x-rays arms/legs,,N1,,,
75726,,Artery x-rays abdomen,,N1,,,
75731,,Artery x-rays adrenal gland,,Z3,,$96.72,
75733,,Artery x-rays adrenals,,N1,,,
75736,,Artery x-rays pelvis,,N1,,,
75741,,Artery x-rays lung,,N1,,,
75743,,Artery x-rays lungs,,N1,,,
75746,,Artery x-rays lung,,Z3,,$80.22,
75756,,Artery x-rays chest,,N1,,,
75774,,Artery x-ray each vessel,,N1,,,
75801,,Lymph vessel x-ray arm/leg,,N1,,,
75803,,Lymph vessel x-ray arms/legs,,Z2,11.5201,$632.40,
75805,,Lymph vessel x-ray trunk,,Z2,28.9406,"$1,588.69",
75807,,Lymph vessel x-ray trunk,,N1,,,
75809,,Nonvascular shunt x-ray,,N1,,,
75810,,Vein x-ray spleen/liver,,Z2,28.9406,"$1,588.69",
75820,,Vein x-ray arm/leg,,N1,,,
75822,,Vein x-ray arms/legs,,Z3,,$62.43,
75825,,Vein x-ray trunk,,N1,,,
75827,,Vein x-ray chest,,N1,,,
75831,,Vein x-ray kidney,,N1,,,
75833,,Vein x-ray kidneys,,N1,,,
75840,,Vein x-ray adrenal gland,,N1,,,
75842,,Vein x-ray adrenal glands,,N1,,,
75860,,Vein x-ray neck,,N1,,,
75870,,Vein x-ray skull,,Z3,,$100.60,
75872,,Vein x-ray skull epidural,,N1,,,
75880,,Vein x-ray eye socket,,N1,,,
75885,,Vein x-ray liver w/hemodynam,,N1,,,
75887,,Vein x-ray liver w/o hemodyn,,Z3,,$69.87,
75889,,Vein x-ray liver w/hemodynam,,N1,,,
75891,,Vein x-ray liver,,N1,,,
75893,,Venous sampling by catheter,,N1,,,
75894,,X-rays transcath therapy,,N1,,,
75898,,Follow-up angiography,,Z2,28.9406,"$1,588.69",
75901,,Remove cva device obstruct,,N1,,,
75902,,Remove cva lumen obstruct,,N1,,,
75970,,Vascular biopsy,,N1,,,
75984,,Xray control catheter change,,N1,,,
75989,,Abscess drainage under x-ray,,N1,,,
76000,,Fluoroscopy <1 hr phys/qhp,,Z3,,$26.85,
76010,,X-ray nose to rectum,,N1,,,
76080,,X-ray exam of fistula,,N1,,,
76098,,X-ray exam surgical specimen,,N1,,,
76100,,X-ray exam of body section,,N1,,,
76120,,Cine/video x-rays,,N1,,,
76125,,Cine/video x-rays add-on,,N1,,,
76145,,Med physic dos eval rad exps,,Z2,5.1914,$284.98,
76376,,3d render w/intrp postproces,,N1,,,
76377,,3d render w/intrp postproces,,N1,,,
76380,,Cat scan follow-up study,,N1,,,
76390,,Mr spectroscopy,,Z2,0.8852,$48.59,
76391,,Mr elastography,,Z2,2.3732,$130.28,
76496,,Unlisted fluoroscopic px,,N1,,,
76497,,Unlisted ct procedure,,N1,,,
76498,,Unlisted mr procedure,,Z2,0.8852,$48.59,
76499,,Unlisted dx radiographic px,,N1,,,
76506,,Echo exam of head,,N1,,,
76510,,Oph us dx b-scan&quan a-scan,,N1,,,
76511,,Oph us dx quan a-scan only,,N1,,,
76512,,Oph us dx b-scan,,N1,,,
76513,,Oph us dx ant sgm us uni/bi,,N1,,,
76514,,Echo exam of eye thickness,,N1,,,
76516,,Echo exam of eye,,N1,,,
76519,,Echo exam of eye,,N1,,,
76529,,Echo exam of eye,,N1,,,
76536,,Us exam of head and neck,,N1,,,
76604,,Us exam chest,,N1,,,
76641,,Ultrasound breast complete,,N1,,,
76642,,Ultrasound breast limited,,N1,,,
76700,,Us exam abdom complete,,Z2,1.033,$56.71,
76705,,Echo exam of abdomen,,Z2,1.033,$56.71,
76770,,Us exam abdo back wall comp,,Z2,1.033,$56.71,
76775,,Us exam abdo back wall lim,,N1,,,
76776,,Us exam k transpl w/doppler,,Z2,1.033,$56.71,
76800,,Us exam spinal canal,,N1,,,
76801,,Ob us < 14 wks single fetus,,Z2,1.033,$56.71,
76802,,Ob us < 14 wks addl fetus,,N1,,,
76805,,Ob us >= 14 wks sngl fetus,,Z2,1.033,$56.71,
76810,,Ob us >= 14 wks addl fetus,,N1,,,
76811,,Ob us detailed sngl fetus,,Z3,,$84.75,
76812,,Ob us detailed addl fetus,,N1,,,
76813,,Ob us nuchal meas 1 gest,,N1,,,
76814,,Ob us nuchal meas add-on,,N1,,,
76815,,Ob us limited fetus(s),,N1,,,
76816,,Ob us follow-up per fetus,,N1,,,
76817,,Transvaginal us obstetric,,N1,,,
76818,,Fetal biophys profile w/nst,,Z2,1.033,$56.71,
76819,,Fetal biophys profil w/o nst,,Z3,,$47.55,
76820,,Umbilical artery echo,,N1,,,
76821,,Middle cerebral artery echo,,N1,,,
76825,,Echo exam of fetal heart,,Z3,,$171.76,
76826,,Echo exam of fetal heart,,Z3,,$110.95,
76827,,Echo exam of fetal heart,,N1,,,
76828,,Echo exam of fetal heart,,N1,,,
76830,,Transvaginal us non-ob,,Z2,1.033,$56.71,
76831,,Echo exam uterus,,Z3,,$76.98,
76856,,Us exam pelvic complete,,Z2,1.033,$56.71,
76857,,Us exam pelvic limited,,Z3,,$25.55,
76870,,Us exam scrotum,,N1,,,
76872,,Us transrectal,,Z2,1.033,$56.71,
76873,,Echograp trans r pros study,,Z2,1.033,$56.71,
76881,,Us compl joint r-t w/img,,Z3,,$10.03,
76882,,Us lmtd jt/fcl evl nvasc xtr,,N1,,,
76883,,Us nrv&acc strux 1xtr compre,,N1,,,
76885,,Us exam infant hips dynamic,,N1,,,
76886,,Us exam infant hips static,,N1,,,
76932,,Echo guide for heart biopsy,,N1,,,
76936,,Echo guide for artery repair,,Z3,,$158.82,
76937,,Us guide vascular access,,N1,,,
76940,,Us guide tissue ablation,,N1,,,
76941,,Echo guide for transfusion,,N1,,,
76942,,Echo guide for biopsy,,N1,,,
76945,,Echo guide villus sampling,,N1,,,
76946,,Echo guide for amniocentesis,,N1,,,
76948,,Echo guide ova aspiration,,N1,,,
76965,,Echo guidance radiotherapy,,N1,,,
76975,,Gi endoscopic ultrasound,,N1,,,
76977,**,Us bone density measure,,Z3,,$4.21,
76978,,Us trgt dyn mbubb 1st les,,Z2,1.7618,$96.71,
76979,,Us trgt dyn mbubb ea addl,,N1,,,
76981,,Use parenchyma,,Z2,1.033,$56.71,
76982,,Use 1st target lesion,,Z2,1.033,$56.71,
76983,,Use ea addl target lesion,,N1,,,
76998,,Us guide intraop,,N1,,,
76999,,Echo examination procedure,,N1,,,
77001,,Fluoroguide for vein device,,N1,,,
77002,,Needle localization by xray,,N1,,,
77003,,Fluoroguide for spine inject,,N1,,,
77011,,Ct scan for localization,,N1,,,
77012,,Ct scan for needle biopsy,,N1,,,
77013,,Ct guide for tissue ablation,,N1,,,
77014,,Ct scan for therapy guide,,N1,,,
77021,,Mri guidance ndl plmt rs&i,,N1,,,
77022,,Mri gdn parnchyma tiss abltj,,N1,,,
77046,,Mri breast c- unilateral,,Z2,2.3732,$130.28,
77047,,Mri breast c- bilateral,,Z2,2.3732,$130.28,
77053,,X-ray of mammary duct,,N1,,,
77054,,X-ray of mammary ducts,,N1,,,
77071,,Mnl appl strs jt radiography,,N1,,,
77072,,Bone age studies,,N1,,,
77073,,Bone length studies,,N1,,,
77074,,Radex osseous survey lmtd,,N1,,,
77075,,Radex osseous survey compl,,N1,,,
77076,,Radex osseous survey infant,,N1,,,
77077,,Joint survey single view,,N1,,,
77078,**,Ct bone density axial,,Z2,0.8852,$48.59,
77080,**,Dxa bone density axial,,Z3,,$28.79,
77081,**,Dxa bone density appendiculr,,Z3,,$21.67,
77084,,Mri bone marrow blood supply,,Z2,2.3732,$130.28,
77085,**,Dxa bone density axl vrt fx,,N1,,,
77086,,Vrt fracture assmt via dxa,,N1,,,
77280,,Ther rad simulaj field smpl,,Z2,1.2958,$71.13,
77285,,Ther rad simulaj field intrm,,Z2,3.5793,$196.49,
77290,,Ther rad simulaj field cplx,,Z2,3.5793,$196.49,
77293,,Respirator motion mgmt simul,,N1,,,
77295,,3-d radiotherapy plan,,Z3,,$249.39,
77299,,Unlisted px ther rad tx plng,,Z2,1.2958,$71.13,
77300,,Radiation therapy dose plan,,Z3,,$32.99,
77301,,Radiotherapy dose plan imrt,,Z2,13.3566,$733.21,
77306,,Telethx isodose plan simple,,Z3,,$73.10,
77307,,Telethx isodose plan cplx,,Z3,,$132.62,
77316,,Brachytx isodose plan simple,,Z3,,$167.55,
77317,,Brachytx isodose intermed,,Z2,3.5793,$196.49,
77318,,Brachytx isodose complex,,Z2,3.5793,$196.49,
77321,,Special teletx port plan,,Z3,,$43.34,
77331,,Special radiation dosimetry,,Z3,,$18.44,
77332,,Radiation treatment aid(s),,Z3,,$16.17,
77333,,Radiation treatment aid(s),,Z2,1.2958,$71.13,
77334,,Radiation treatment aid(s),,Z3,,$63.72,
77336,,Radiation physics consult,,Z2,1.2958,$71.13,
77338,,Design mlc device for imrt,,Z2,3.5793,$196.49,
77370,,Radiation physics consult,,Z2,1.2958,$71.13,
77385,,Ntsty modul rad tx dlvr smpl,,Z2,5.6574,$310.56,
77386,,Ntsty modul rad tx dlvr cplx,,Z2,5.6574,$310.56,
77387,,Guidance for radj tx dlvr,,N1,,,
77399,,Unlisted px med radj physics,,Z2,1.2958,$71.13,
77401,,Radiation tx delivery supfc,,Z3,,$39.46,
77402,,Radiation tx delivery simple,,Z2,1.0711,$58.80,
77407,,Radiation tx delivery intrm,,Z2,2.5722,$141.20,
77412,,Radiation tx delivery complx,,Z2,2.5722,$141.20,
77417,,Ther radiology port image(s),,N1,,,
77423,,Neutron beam tx complex,,Z3,,$32.99,
77424,,Io rad tx delivery by x-ray,,Z2,40.7015,"$2,234.31",
77425,,Io rad tx deliver by elctrns,,Z2,40.7015,"$2,234.31",
77435,,Sbrt management,,N1,,,
77470,,Special radiation treatment,,Z3,,$37.20,
77520,,Proton trmt simple w/o comp,,Z2,5.6574,$310.56,
77522,,Proton trmt simple w/comp,,Z2,12.4618,$684.09,
77523,,Proton trmt intermediate,,Z2,12.4618,$684.09,
77525,,Proton treatment complex,,Z2,12.4618,$684.09,
77600,,Hyperthermia ext gen supfc,,Z2,2.5722,$141.20,
77605,,Hyperthermia ext gen deep,,Z2,6.8543,$376.27,
77610,,Hyperthermia ntrstl prb 5/<,,Z2,5.6574,$310.56,
77615,,Hyperthermia ntrstl prb>5,,Z2,5.6574,$310.56,
77620,,Hyperthermia gen intrcv prb,,Z2,5.6574,$310.56,
77750,,Infuse radioactive materials,,Z3,,$128.74,
77761,,Apply intrcav radiat simple,,Z3,,$213.81,
77762,,Apply intrcav radiat interm,,Z3,,$246.16,
77763,,Apply intrcav radiat compl,,Z3,,$323.47,
77767,,Hdr rdncl skn surf brachytx,,Z2,2.5722,$141.20,
77768,,Hdr rdncl skn surf brachytx,,Z2,2.5722,$141.20,
77770,,Hdr rdncl ntrstl/icav brchtx,,Z3,,$237.42,
77771,,Hdr rdncl ntrstl/icav brchtx,,Z2,6.8543,$376.27,
77772,,Hdr rdncl ntrstl/icav brchtx,,Z2,6.8543,$376.27,
77778,,Apply interstit radiat compl,,Z2,6.8543,$376.27,
77789,,Apply surf ldr radionuclide,,Z2,1.0711,$58.80,
77790,,Radiation handling,,N1,,,
77799,,Unlisted px clin brachytx,,Z2,1.0711,$58.80,
78012,,Thyroid uptake measurement,,Z2,3.9486,$216.76,
78013,,Thyroid imaging w/blood flow,,Z2,3.9486,$216.76,
78014,,Thyroid imaging w/blood flow,,Z2,3.9486,$216.76,
78015,,Thyroid met imaging,,Z2,3.9486,$216.76,
78016,,Thyroid met imaging/studies,,Z2,3.9486,$216.76,
78018,,Thyroid met imaging body,,Z2,5.3104,$291.51,
78020,,Thyroid met uptake,,N1,,,
78070,,Parathyroid planar imaging,,Z2,3.9486,$216.76,
78071,,Parathyrd planar w/wo subtrj,,Z2,3.9486,$216.76,
78072,,Parathyrd planar w/spect&ct,,Z2,5.3104,$291.51,
78075,,Adrenal cortex & medulla img,,Z2,12.983,$712.70,
78099,,Unlisted endocrine px dx nuc,,Z2,3.9486,$216.76,
78102,,Bone marrow imaging ltd,,Z2,3.9486,$216.76,
78103,,Bone marrow imaging mult,,Z2,3.9486,$216.76,
78104,,Bone marrow imaging body,,Z2,3.9486,$216.76,
78110,,Plasma volume single,,Z2,12.983,$712.70,
78111,,Plasma volume multiple,,Z2,12.983,$712.70,
78120,,Red cell mass single,,Z2,3.9486,$216.76,
78121,,Red cell mass multiple,,Z2,5.3104,$291.51,
78122,,Whl bld volume determination,,Z2,5.3104,$291.51,
78130,,Red cell survival study,,Z2,3.9486,$216.76,
78140,,Red cell sequestration,,Z2,3.9486,$216.76,
78185,,Spleen imaging,,Z2,3.9486,$216.76,
78191,,Platelet survival study,,Z2,3.9486,$216.76,
78195,,Lymph system imaging,,Z2,5.3104,$291.51,
78199,,Unlstd hematop ret/endo lymp,,Z2,3.9486,$216.76,
78201,,Liver imaging static only,,Z2,5.3104,$291.51,
78202,,Liver imaging with vasc flow,,Z2,5.3104,$291.51,
78215,,Lvr&spleen img static only,,Z2,3.9486,$216.76,
78216,,Lvr&spleen img w/vasc flow,,Z2,3.9486,$216.76,
78226,,Hepatobiliary system imaging,,Z2,3.9486,$216.76,
78227,,Hepatobil syst image w/drug,,Z2,5.3104,$291.51,
78230,,Salivary gland imaging,,Z2,3.9486,$216.76,
78231,,Salivary glnd img serial img,,Z2,3.9486,$216.76,
78232,,Salivary gland function std,,Z2,3.9486,$216.76,
78258,,Esophageal motility,,Z2,3.9486,$216.76,
78261,,Gastric mucosa imaging,,Z2,3.9486,$216.76,
78262,,Gastroesophageal reflux std,,Z2,3.9486,$216.76,
78264,,Gastric emptying imag study,,Z2,3.9486,$216.76,
78265,,Gastric emptying imag study,,Z2,3.9486,$216.76,
78266,,Gastric emptying imag study,,Z2,5.3104,$291.51,
78278,,Acute gi blood loss imaging,,Z2,3.9486,$216.76,
78282,,Gi protein loss exam,,Z2,3.9486,$216.76,
78290,,Meckels divert exam,,Z2,3.9486,$216.76,
78291,,Leveen/shunt patency exam,,Z2,3.9486,$216.76,
78299,,Unlisted gi px dx nuc med,,Z2,3.9486,$216.76,
78300,,Bone imaging limited area,,Z2,3.9486,$216.76,
78305,,Bone imaging multiple areas,,Z2,3.9486,$216.76,
78306,,Bone imaging whole body,,Z2,3.9486,$216.76,
78315,,Bone imaging 3 phase,,Z2,3.9486,$216.76,
78399,,Unlisted muscskel px dx nuc,,Z2,3.9486,$216.76,
78414,,Non-imaging heart function,,Z2,5.3104,$291.51,
78428,,Cardiac shunt imaging,,Z2,3.9486,$216.76,
78429,,Myocrd img pet 1 std w/ct,,Z2,14.2684,$783.26,
78430,,Myocrd img pet rst/strs w/ct,,Z2,14.2684,$783.26,
78431,,Myocrd img pet rst&strs ct,,Z2,22.0081,"$1,208.13",
78432,,Myocrd img pet 2rtracer,,Z2,19.0743,"$1,047.08",
78433,,Myocrd img pet 2rtracer ct,,Z2,22.0081,"$1,208.13",
